[
  {
    "chunk_id": "hdfc_banking_financial_services_overview",
    "fund_id": "hdfc_banking_financial_services",
    "fund_name": "HDFC Banking & Financial Services Fund",
    "source_url": "https://www.indmoney.com/mutual-funds/hdfc-banking-financial-services-fund-direct-growth-1006661",
    "chunk_type": "overview",
    "metadata_tags": [
      "fund_name",
      "category",
      "benchmark",
      "inception_date"
    ],
    "content": "HDFC Banking & Financial Services Fund is a Equity - Sectoral mutual fund offered under the Direct Plan - Growth option. The fund's benchmark index is Nifty Financial Services TR INR. It was launched on N/A. (Source: https://www.indmoney.com/mutual-funds/hdfc-banking-financial-services-fund-direct-growth-1006661)",
    "last_updated": "2026-03-05T05:41:32.015230+00:00"
  },
  {
    "chunk_id": "hdfc_banking_financial_services_nav",
    "fund_id": "hdfc_banking_financial_services",
    "fund_name": "HDFC Banking & Financial Services Fund",
    "source_url": "https://www.indmoney.com/mutual-funds/hdfc-banking-financial-services-fund-direct-growth-1006661",
    "chunk_type": "nav",
    "metadata_tags": [
      "nav",
      "nav_date",
      "since_inception"
    ],
    "content": "The current NAV of HDFC Banking & Financial Services Fund is ₹18.82 as of 04 Mar 2026. The fund has returned None since inception. (Source: https://www.indmoney.com/mutual-funds/hdfc-banking-financial-services-fund-direct-growth-1006661)",
    "last_updated": "2026-03-05T05:41:32.015230+00:00"
  },
  {
    "chunk_id": "hdfc_banking_financial_services_returns",
    "fund_id": "hdfc_banking_financial_services",
    "fund_name": "HDFC Banking & Financial Services Fund",
    "source_url": "https://www.indmoney.com/mutual-funds/hdfc-banking-financial-services-fund-direct-growth-1006661",
    "chunk_type": "returns",
    "metadata_tags": [
      "1M",
      "3M",
      "6M",
      "1Y",
      "3Y",
      "5Y",
      "inception"
    ],
    "content": "HDFC Banking & Financial Services Fund performance:\n  1M: 3.31%\n  3M: 1.45%\n  6M: 8.07%\n  1Y: 23.66%\n  3Y: 17.87%\n  5Y: --\nBenchmark comparison:\n  1M: 1.56%\n  3M: 2.42%\n  6M: 1.52%\n  1Y: 16.31%\n  3Y: 16.18%\n  5Y: 12.79%\n(Source: https://www.indmoney.com/mutual-funds/hdfc-banking-financial-services-fund-direct-growth-1006661)",
    "last_updated": "2026-03-05T05:41:32.015230+00:00"
  },
  {
    "chunk_id": "hdfc_banking_financial_services_costs",
    "fund_id": "hdfc_banking_financial_services",
    "fund_name": "HDFC Banking & Financial Services Fund",
    "source_url": "https://www.indmoney.com/mutual-funds/hdfc-banking-financial-services-fund-direct-growth-1006661",
    "chunk_type": "costs",
    "metadata_tags": [
      "expense_ratio",
      "exit_load",
      "stamp_duty"
    ],
    "content": "The HDFC Banking & Financial Services Fund has an expense ratio of 0.8%. The exit load is 1% if redeemed in 0-30 Days. (Source: https://www.indmoney.com/mutual-funds/hdfc-banking-financial-services-fund-direct-growth-1006661)",
    "last_updated": "2026-03-05T05:41:32.015230+00:00"
  },
  {
    "chunk_id": "hdfc_banking_financial_services_risk",
    "fund_id": "hdfc_banking_financial_services",
    "fund_name": "HDFC Banking & Financial Services Fund",
    "source_url": "https://www.indmoney.com/mutual-funds/hdfc-banking-financial-services-fund-direct-growth-1006661",
    "chunk_type": "risk",
    "metadata_tags": [
      "riskometer_level",
      "lock_in",
      "suitable_for"
    ],
    "content": "The riskometer rating for HDFC Banking & Financial Services Fund is Very High. Lock-in period: None. (Source: https://www.indmoney.com/mutual-funds/hdfc-banking-financial-services-fund-direct-growth-1006661)",
    "last_updated": "2026-03-05T05:41:32.015230+00:00"
  },
  {
    "chunk_id": "hdfc_banking_financial_services_investment",
    "fund_id": "hdfc_banking_financial_services",
    "fund_name": "HDFC Banking & Financial Services Fund",
    "source_url": "https://www.indmoney.com/mutual-funds/hdfc-banking-financial-services-fund-direct-growth-1006661",
    "chunk_type": "investment",
    "metadata_tags": [
      "min_sip",
      "min_lumpsum",
      "sip_frequency"
    ],
    "content": "To invest in HDFC Banking & Financial Services Fund: Minimum SIP amount is ₹100. Minimum lumpsum investment is ₹100. (Source: https://www.indmoney.com/mutual-funds/hdfc-banking-financial-services-fund-direct-growth-1006661)",
    "last_updated": "2026-03-05T05:41:32.015230+00:00"
  },
  {
    "chunk_id": "hdfc_banking_financial_services_portfolio",
    "fund_id": "hdfc_banking_financial_services",
    "fund_name": "HDFC Banking & Financial Services Fund",
    "source_url": "https://www.indmoney.com/mutual-funds/hdfc-banking-financial-services-fund-direct-growth-1006661",
    "chunk_type": "portfolio",
    "metadata_tags": [
      "holdings",
      "sectors",
      "total_holdings"
    ],
    "content": "Portfolio of HDFC Banking & Financial Services Fund:\nTop Holdings:\n  - HDFC Bank Ltd: 18.85%\n  - ICICI Bank Ltd: 15.1%\n  - Axis Bank Ltd: 8.67%\n(Source: https://www.indmoney.com/mutual-funds/hdfc-banking-financial-services-fund-direct-growth-1006661)",
    "last_updated": "2026-03-05T05:41:32.015230+00:00"
  },
  {
    "chunk_id": "hdfc_banking_financial_services_aum",
    "fund_id": "hdfc_banking_financial_services",
    "fund_name": "HDFC Banking & Financial Services Fund",
    "source_url": "https://www.indmoney.com/mutual-funds/hdfc-banking-financial-services-fund-direct-growth-1006661",
    "chunk_type": "aum",
    "metadata_tags": [
      "aum_value",
      "aum_date"
    ],
    "content": "The Assets Under Management (AUM) of HDFC Banking & Financial Services Fund is ₹4486 Cr. (Source: https://www.indmoney.com/mutual-funds/hdfc-banking-financial-services-fund-direct-growth-1006661)",
    "last_updated": "2026-03-05T05:41:32.015230+00:00"
  },
  {
    "chunk_id": "hdfc_banking_financial_services_manager",
    "fund_id": "hdfc_banking_financial_services",
    "fund_name": "HDFC Banking & Financial Services Fund",
    "source_url": "https://www.indmoney.com/mutual-funds/hdfc-banking-financial-services-fund-direct-growth-1006661",
    "chunk_type": "manager",
    "metadata_tags": [
      "manager_name",
      "experience",
      "qualification"
    ],
    "content": "HDFC Banking & Financial Services Fund is managed by Anand Laddha. (Source: https://www.indmoney.com/mutual-funds/hdfc-banking-financial-services-fund-direct-growth-1006661)",
    "last_updated": "2026-03-05T05:41:32.015230+00:00"
  },
  {
    "chunk_id": "hdfc_banking_financial_services_documents",
    "fund_id": "hdfc_banking_financial_services",
    "fund_name": "HDFC Banking & Financial Services Fund",
    "source_url": "https://www.indmoney.com/mutual-funds/hdfc-banking-financial-services-fund-direct-growth-1006661",
    "chunk_type": "documents",
    "metadata_tags": [
      "sid_link",
      "kim_link",
      "factsheet_link",
      "hdfc_amc_url"
    ],
    "content": "Official documents for HDFC Banking & Financial Services Fund:\n  - SID (Scheme Information Document): Not available\n  - KIM (Key Information Memorandum): Not available\n  - Monthly Factsheet: Not available\n  - HDFC AMC Official Page: https://www.hdfcfund.com/mutual-fund/equity-mutual-fund/hdfc-banking-and-financial-services-fund\n(Source: https://www.indmoney.com/mutual-funds/hdfc-banking-financial-services-fund-direct-growth-1006661)",
    "last_updated": "2026-03-05T05:41:32.015230+00:00"
  },
  {
    "chunk_id": "hdfc_banking_financial_services_faq_01",
    "fund_id": "hdfc_banking_financial_services",
    "fund_name": "HDFC Banking & Financial Services Fund",
    "source_url": "https://www.indmoney.com/mutual-funds/hdfc-banking-financial-services-fund-direct-growth-1006661",
    "chunk_type": "faq",
    "metadata_tags": [
      "question",
      "answer",
      "faq"
    ],
    "content": "Q: How do I invest in HDFC Banking & Financial Services Fund?\nA: INDmoney makes it simple to invest in the HDFC Banking & Financial Services Fund. To do so, follow the steps below:Download the INDmoney app.Search for ‘HDFC Banking & Financial Services Fund’.Select whether you want to invest in SIP or lump sum.Enter the amount you wish to invest.Set up payments via bank mandate or UPI.\n(Source: https://www.indmoney.com/mutual-funds/hdfc-banking-financial-services-fund-direct-growth-1006661)",
    "last_updated": "2026-03-05T05:41:32.015230+00:00"
  },
  {
    "chunk_id": "hdfc_banking_financial_services_faq_02",
    "fund_id": "hdfc_banking_financial_services",
    "fund_name": "HDFC Banking & Financial Services Fund",
    "source_url": "https://www.indmoney.com/mutual-funds/hdfc-banking-financial-services-fund-direct-growth-1006661",
    "chunk_type": "faq",
    "metadata_tags": [
      "question",
      "answer",
      "faq"
    ],
    "content": "Q: What is the current NAV of HDFC Banking & Financial Services Fund?\nA: The NAV of the fund today is ₹18.82. NAV or Net Asset Value is the per unit price of a mutual fund. For example, if the NAV of a fund is ₹10, it means you can get 1000 units of that mutual fund at ₹10,000.\n(Source: https://www.indmoney.com/mutual-funds/hdfc-banking-financial-services-fund-direct-growth-1006661)",
    "last_updated": "2026-03-05T05:41:32.015230+00:00"
  },
  {
    "chunk_id": "hdfc_banking_financial_services_faq_03",
    "fund_id": "hdfc_banking_financial_services",
    "fund_name": "HDFC Banking & Financial Services Fund",
    "source_url": "https://www.indmoney.com/mutual-funds/hdfc-banking-financial-services-fund-direct-growth-1006661",
    "chunk_type": "faq",
    "metadata_tags": [
      "question",
      "answer",
      "faq"
    ],